{
  "comparison_questions": [],
  "contract_version": "1.0.0",
  "entities": [
    {
      "canonical": "AWS",
      "entity_id": "amazon-web-services",
      "raw": "AWS",
      "resolution": "exact"
    }
  ],
  "episode_date": "2026-08-06",
  "indicators": [],
  "lead_candidates": [
    "AI設備投資の回収"
  ],
  "limits": {
    "max_characters": 10000,
    "max_claims": 10,
    "max_episodes": 3,
    "max_lessons": 3,
    "max_threads": 5
  },
  "policies": [],
  "relations": [],
  "technologies": [
    "クラウド"
  ],
  "time_window": {
    "from": "2026-07-01",
    "to": "2026-08-06"
  },
  "topics": [
    "AI設備投資"
  ]
}
